{
  "schemaVersion": 1,
  "generatedAt": "2026-10-05T00:00:00.030Z",
  "durationMs": 30,
  "settings": {
    "samples": 2,
    "timeoutMs": 1000,
    "concurrency": 1,
    "lagThreshold": 3
  },
  "results": [
    {
      "endpoint": "RPC 1",
      "chainId": "1",
      "latestBlock": "18446744073709551617",
      "attempts": 2,
      "successes": 2,
      "errors": {},
      "latencyMs": {
        "min": 10,
        "median": 10,
        "p95": 10,
        "max": 10,
        "stddev": 0,
        "p99": 10
      },
      "successRate": 100,
      "lagBlocks": null,
      "peerCount": 0,
      "status": "healthy",
      "latencySampleCount": 2,
      "observations": [
        {
          "round": 1,
          "startedMs": 10,
          "finishedMs": 20,
          "block": "18446744073709551617",
          "error": null
        },
        {
          "round": 2,
          "startedMs": 20,
          "finishedMs": 30,
          "block": "18446744073709551617",
          "error": null
        }
      ]
    }
  ],
  "startedAt": "2026-10-05T00:00:00.000Z",
  "latencyNotes": [
    "Synthetic fixture: latency statistics use successful measured calls only; short samples do not reliably estimate tails."
  ],
  "rounds": [
    {
      "round": 1,
      "startedMs": 10,
      "finishedMs": 20
    },
    {
      "round": 2,
      "startedMs": 20,
      "finishedMs": 30
    }
  ]
}
