{
  "schemaVersion": 1,
  "generatedAt": "2026-10-05T00:00:00.000Z",
  "durationMs": 35,
  "settings": {
    "samples": 2,
    "timeoutMs": 1000,
    "concurrency": 1,
    "lagThreshold": 3,
    "expectedChain": "1",
    "reference": 1,
    "warmup": 1
  },
  "results": [
    {
      "endpoint": "Primary",
      "chainId": "1",
      "latestBlock": "18446744073709551617",
      "attempts": 2,
      "successes": 2,
      "errors": {},
      "latencyMs": {
        "min": 10,
        "median": 10,
        "p95": 10,
        "max": 10
      },
      "successRate": 100,
      "lagBlocks": null,
      "peerCount": 0,
      "status": "degraded",
      "networkStatus": "match",
      "lagStatus": "reference",
      "warmup": {
        "attempts": 1,
        "successes": 0,
        "errors": {
          "RPC_ERROR": 1
        },
        "durationMs": 5
      }
    }
  ]
}
